{
  "$schema": "./delfour.instance.schema.json",
  "caseName": "Delfour",
  "retailer": "Delfour",
  "question": "Is the Delfour self-scanner allowed to use a neutral shopping insight for shopping assistance, and if so what lower-sugar alternative should it suggest?",
  "timestamps": {
    "createdAt": "2025-10-05T20:33:48.907163+00:00",
    "expiresAt": "2025-10-05T22:33:48.907185+00:00",
    "authorizedAt": "2025-10-05T20:35:48.907163+00:00",
    "dutyPerformedAt": "2025-10-05T20:37:48.907163+00:00"
  },
  "evaluationContext": {
    "scopeDevice": "self-scanner",
    "scopeEvent": "pick_up_scanner",
    "purpose": "shopping_assist",
    "prohibitedReusePurpose": "marketing",
    "requestAction": "odrl:use"
  },
  "thresholds": {
    "sugarPerServingGAtLeast": 10.0
  },
  "householdProfile": {
    "condition": "Diabetes"
  },
  "catalog": [
    {
      "id": "prod:BIS_001",
      "name": "Classic Tea Biscuits",
      "sugarTenths": 120,
      "sugarPerServing": 12.0
    },
    {
      "id": "prod:BIS_101",
      "name": "Low-Sugar Tea Biscuits",
      "sugarTenths": 30,
      "sugarPerServing": 3.0
    },
    {
      "id": "prod:CHOC_050",
      "name": "Milk Chocolate Bar",
      "sugarTenths": 150,
      "sugarPerServing": 15.0
    },
    {
      "id": "prod:CHOC_150",
      "name": "85% Dark Chocolate",
      "sugarTenths": 60,
      "sugarPerServing": 6.0
    }
  ],
  "scan": {
    "scannedProductId": "prod:BIS_001"
  },
  "insightPolicy": {
    "id": "https://example.org/insight/delfour",
    "metric": "sugar_g_per_serving",
    "type": "ins:Insight",
    "suggestionPolicy": "lower_metric_first_higher_price_ok",
    "policyType": "odrl:Policy",
    "policyProfile": "Delfour-Insight-Policy"
  },
  "integrity": {
    "hashAlgorithm": "SHA-256",
    "macAlgorithm": "HMAC-SHA-256",
    "secret": "neutral-insight-demo-shared-secret",
    "verificationMode": "trustedPrecomputedInput"
  }
}